{
  "strict": true,
  "paths": {
    "rules": [
      {
        "action": "ask",
        "kind": "file",
        "path": "./.env"
      },
      {
        "action": "deny",
        "kind": "directory",
        "path": "~/.ssh"
      },
      {
        "action": "allow",
        "kind": "directory",
        "path": "./node_modules"
      },
      {
        "action": "allow",
        "kind": "directory",
        "path": "${TMPDIR}"
      }
    ]
  },
  "commands": {
    "rules": [],
    "promptWhen": "blocked"
  },
  "llm": {
    "provider": "opencode-go",
    "model": "deepseek-v4.1-flash",
    "timeoutMs": 30000,
    "userPrompt": "",
    "piPath": ""
  },
  "hooks": {
    "afterPrompt": ""
  },
  "audit": {
    "enabled": true
  }
}
